nr_documento_contratado,ano,cep_estab,cnae_2_0_classe,cnae_2_0_classe_2,cnpj_cei,natureza_juridica,porte_estabelecimento,qtd_estoque_aprendiz_ativo,qtd_estoque_clt_defic_ativo,qtd_estoque_estat_defic_ativo,qtd_portador_defic,qtd_vinculos_ativos,qtd_vinculos_clt,qtd_vinculos_estatutarios,razao_social,tamanho_estabelecimento,uf
10553099000102,2017,95.650.000,46338,Comércio Atacadista,10.553.099/0001-02,Cooperativa,Outros,0,0,0,0,0,0,0,COOPERATIVA PROD AGRICOLAS IGREJINHA COOPAI        ,0 Empregado,43 - Rio Grande do S
07635210000103,2017,95.580.000,46231,Comércio Atacadista,07.635.210/0001-03,Cooperativa,Outros,0,0,0,0,2,2,0,COOPERATIVA REG PRODUTORES ECOLOGISTAS LIT NORTE RS,De 1 a 4,43 - Rio Grande do S
09660975000110,2017,95.800.000,94120,Atividades de Organi,09.660.975/0001-10,Cooperativa,Outros,0,0,0,0,0,0,0,COOP DOS PRODUTORES VENANCIO AIRES COOP            ,0 Empregado,43 - Rio Grande do S
10568281000137,2017,92.480.000,47890,Comércio Varejista d,10.568.281/0001-37,Cooperativa,Outros,0,0,0,0,8,8,0,COOPERATIVA DOS TRABALHADORES DA REFORMA AGRARIA TER,De 5 a 9,43 - Rio Grande do S
00861664000145,2017,92.480.000,10121,"Abate de Suínos, Ave",00.861.664/0001-45,Cooperativa,Outros,0,0,0,0,3,3,0,COOPERATIVA DE PRODUCAO AGROPECUARIA NOVA SANTA RITA,De 1 a 4,43 - Rio Grande do S
89774160000525,2017,95.893.000,10121,"Abate de Suínos, Ave",89.774.160/0005-25,Cooperativa,Outros,42,47,0,47,898,898,0,COOPERATIVA LANGUIRU LTDA                          ,De 500 a 999,43 - Rio Grande do S
21308597000106,2017,98.910.000,47245,Comércio Varejista d,21.308.597/0001-06,Cooperativa,Outros,0,0,0,0,0,0,0,COOPERNOROESTECOOP DE AGRIC FAMILI DO NOROESTE GAUCH,0 Empregado,43 - Rio Grande do S
89774160000606,2017,95.890.000,10520,Fabricação de Laticí,89.774.160/0006-06,Cooperativa,Outros,8,8,0,8,199,199,0,COOPERATIVA LANGUIRU LTDA                          ,De 100 a 249,43 - Rio Grande do S
91022632000101,2017,97.250.000,46222,Comércio Atacadista,91.022.632/0001-01,Cooperativa,Outros,0,0,0,0,112,112,0,COOP AGRIC MISTA NOVA PALMA LTDA                   ,De 100 a 249,43 - Rio Grande do S
88587357000169,2017,95.185.000,82113,Serviços Combinados,88.587.357/0001-69,Cooperativa,Outros,4,3,0,3,102,102,0,COOPERATIVA SANTA CLARA LTDA                       ,De 100 a 249,43 - Rio Grande do S
12267460000160,2017,99.900.000,46338,Comércio Atacadista,12.267.460/0001-60,Cooperativa,Outros,0,0,0,0,0,0,0,COOPERATIVA REGIONAL DA AGRICULTURA FAMILIAR DE GETU,0 Empregado,43 - Rio Grande do S
91360420000134,2017,95.785.000,10121,"Abate de Suínos, Ave",91.360.420/0001-34,Cooperativa,Outros,0,14,0,14,397,397,0,COOP SUINOCULTORES DO CAI SUPERIOR LTDA            ,De 250 a 499,43 - Rio Grande do S
89774160001335,2017,95.740.000,10121,"Abate de Suínos, Ave",89.774.160/0013-35,Cooperativa,Outros,24,27,0,27,745,745,0,COOPERATIVA LANGUIRU LTDA                          ,De 500 a 999,43 - Rio Grande do S
08546254000111,2017,97.015.001,46338,Comércio Atacadista,08.546.254/0001-11,Cooperativa,Outros,0,0,0,0,5,5,0,COOP PROD E DESENV RURAL DOS AGRIC FAMIL           ,De 5 a 9,43 - Rio Grande do S
12309267000144,2017,95.923.000,1326,Cultivo de Uva,12.309.267/0001-44,Sociedade Qt Ltda,Pequeno Porte,0,0,0,0,0,0,0,VINICOLA PALUDO LTDA EPP                           ,0 Empregado,43 - Rio Grande do S
21853581000184,2017,95.748.000,10139,Fabricação de Produt,21.853.581/0001-84,Firma Mercantil Indi,Microempresa,0,0,0,0,14,14,0,HERBON AGROINDUSTRIA LTDA   EPP                   ,De 10 a 19,43 - Rio Grande do S
73273526000119,2017,99.750.000,46311,Comércio Atacadista,73.273.526/0001-19,Cooperativa,Outros,1,0,0,0,18,18,0,COOP DE PEQUENOS AGROPECUARISTAS DE ERVAL GRANDE LTD,De 10 a 19,43 - Rio Grande do S
88587357000240,2017,95.185.000,10520,Fabricação de Laticí,88.587.357/0002-40,Cooperativa,Outros,19,24,0,24,423,423,0,COOPERATIVA SANTA CLARA LTDA                       ,De 250 a 499,43 - Rio Grande do S
88587357006604,2017,95.185.000,46311,Comércio Atacadista,88.587.357/0066-04,Cooperativa,Outros,2,1,0,1,29,29,0,COOPERATIVA SANTA CLARA LTDA                       ,De 20 a 49,43 - Rio Grande do S
12109796000102,2017,95.600.000,82300,Atividades de Organi,12.109.796/0001-02,Outras Organizações,Microempresa,0,0,0,0,0,0,0,ATAF                                               ,0 Empregado,43 - Rio Grande do S
04901469000152,2017,96.810.090,47296,Comércio Varejista d,04.901.469/0001-52,Cooperativa,Outros,0,0,0,0,2,2,0,"ECOVALE, COOPERATIVA REGIONAL DE AGRICULTORES FAMILI",De 1 a 4,43 - Rio Grande do S
15388008000144,2017,99.709.370,94308,Atividades de Associ,15.388.008/0001-44,Cooperativa,Outros,0,0,0,0,7,7,0,CECAFES COOPERATIVA CENTRAL DE COMERCIALIZACAO DA AG,De 5 a 9,43 - Rio Grande do S
13546912000105,2017,95.920.000,2101,Produção Florestal -,13.546.912/0001-05,Cooperativa,Outros,0,0,0,0,0,0,0,COOP LEOBOQUEIRENSE DE AGRICULTORES FAMILIARES     ,0 Empregado,43 - Rio Grande do S
89774160000363,,,,,,,,,,,,,,,,,
09522322000175,2017,99.470.000,47229,Comércio Varejista d,09.522.322/0001-75,Sociedade Qt Ltda,Microempresa,0,0,0,0,0,0,0,VILSON SAVADINSCKY E CIA LTDA - ME                 ,0 Empregado,43 - Rio Grande do S
11524136000117,2017,99.470.000,10139,Fabricação de Produt,11.524.136/0001-17,Firma Mercantil Indi,Microempresa,0,0,0,0,0,0,0,SOLANGE AULER BINI                                 ,0 Empregado,43 - Rio Grande do S
09399257000132,2017,99.190.000,49302,Transporte Rodoviári,09.399.257/0001-32,Cooperativa,Outros,0,0,0,0,10,10,0,COOP AGROP E LATICINIOS PONTAO LTDA              ,De 10 a 19,43 - Rio Grande do S
10696943000235,2017,98.528.000,47121,Comércio Varejista d,10.696.943/0002-35,Cooperativa,Outros,0,0,0,0,6,6,0,COOPERATIVA MISTA YUCUMA                           ,De 5 a 9,43 - Rio Grande do S
07592085000193,2017,97.970.000,47113,Comércio Varejista d,07.592.085/0001-93,Cooperativa,Outros,0,0,0,0,7,7,0,COOP DE PROD E COM DA AGRIC FAM DE ROQUE GONZALES LT,De 5 a 9,43 - Rio Grande do S
09579969000133,2017,95.920.000,10112,"Abate de Reses, Exce",09.579.969/0001-33,Sociedade Qt Ltda,Microempresa,0,0,0,0,1,1,0,ANGELO BERGONCI & CIA LTDA ME                      ,De 1 a 4,43 - Rio Grande do S
08835220000147,2017,98.465.000,11127,Fabricação de Vinho,08.835.220/0001-47,Cooperativa,Outros,0,0,0,0,6,6,0,COOPERATIVA DE PRODUTORES DE UVA E DERIVADOS DE AMET,De 5 a 9,43 - Rio Grande do S
11329990000122,2017,94.770.970,46231,Comércio Atacadista,11.329.990/0001-22,Cooperativa,Outros,0,0,0,0,0,0,0,COOP DOS PROD ORGANICOS DE REF AGRARIA             ,0 Empregado,43 - Rio Grande do S
89774160000797,,,,,,,,,,,,,,,,,
10917361000150,2017,95.520.000,1610,Atividades de Apoio,10.917.361/0001-50,Cooperativa,Outros,0,0,0,0,1,1,0,COOP DE CONS E COM DOS PEQ PROD RURAIS             ,De 1 a 4,43 - Rio Grande do S
05397605000181,2017,99.840.000,1164,Cultivo de Oleaginos,05.397.605/0001-81,Cooperativa,Outros,0,0,0,0,2,2,0,COOP DE PROD ALIM ORG ECON SOLIDARIA LT            ,De 1 a 4,43 - Rio Grande do S
15072633000182,2017,93.490.000,46338,Comércio Atacadista,15.072.633/0001-82,Cooperativa,Outros,0,0,0,0,0,0,0,COOP DE AGRICULTURA FAMILIAR DE LOMBA GRANDE       ,0 Empregado,43 - Rio Grande do S
09135116000102,2017,99.640.000,46320,Comércio Atacadista,09.135.116/0001-02,Cooperativa,Outros,0,0,0,0,0,0,0,COOP MICRO REGIONAL AGRIC FAM BENJAMIN SAO VALENTIM,0 Empregado,43 - Rio Grande do S
04636068000201,2017,98.500.000,47296,Comércio Varejista d,04.636.068/0002-01,Cooperativa,Outros,0,0,0,0,2,2,0,COOPERATIVA AGROPECUARIA DOS AGRICULTORES FAMILIARES,De 1 a 4,43 - Rio Grande do S
10763636000149,2017,97.980.000,47121,Comércio Varejista d,10.763.636/0001-49,Cooperativa,Outros,0,0,0,0,0,0,0,COOP DA AGRIC E AGROIND FAM DE SAO PAULO DAS MISSOES,0 Empregado,43 - Rio Grande do S
88587357003770,2017,92.420.360,46311,Comércio Atacadista,88.587.357/0037-70,Cooperativa,Outros,3,2,0,2,101,101,0,COOPERATIVA SANTA CLARA LTDA                       ,De 100 a 249,43 - Rio Grande do S
09099485000197,2017,99.560.000,1164,Cultivo de Oleaginos,09.099.485/0001-97,Cooperativa,Outros,0,0,0,0,0,0,0,COOPERATIVA DA PRODUCAO  DOS AGRICULTORES FAMILIARES,0 Empregado,43 - Rio Grande do S
07111971000158,2017,98.640.000,46338,Comércio Atacadista,07.111.971/0001-58,Cooperativa,Outros,0,0,0,0,2,2,0,COOPERATIVA DAS ATIVIDADES AGROINDUSTRIA           ,De 1 a 4,43 - Rio Grande do S
07820110000149,2017,98.985.000,46311,Comércio Atacadista,07.820.110/0001-49,Cooperativa,Outros,0,0,0,0,0,0,0,COOPERATIVA DOS AGRICULTORES DE PORTO VERA CRUZ LTDA,0 Empregado,43 - Rio Grande do S
01112137000109,2017,92.990.000,46231,Comércio Atacadista,01.112.137/0001-09,Cooperativa,Outros,0,0,0,0,12,12,0,COOPERATIVA DOS TRABALHADORES ASSENTADOS DA REGIAO P,De 10 a 19,43 - Rio Grande do S
14782568000116,2017,92.850.000,11224,Fabricação de Refrig,14.782.568/0001-16,Cooperativa,Outros,0,0,0,0,0,0,0,COOPERATIVA AGROPECUARIA DE SERTAO SANTA           ,0 Empregado,43 - Rio Grande do S
05996123000148,,,,,,,,,,,,,,,,,
10348129000149,2017,98.930.000,11127,Fabricação de Vinho,10.348.129/0001-49,Cooperativa,Pequeno Porte,0,0,0,0,0,0,0,COOP VINHO FRONTEIRA NOROESTE E ECONOMIA SOL COOPERV,0 Empregado,43 - Rio Grande do S
88612486000160,2017,95.270.000,10333,Fabricação de Sucos,88.612.486/0001-60,Sociedade Qt Ltda,Outros,13,0,0,0,210,210,0,COOP AGROINDUSTRIAL NOVA ALIANCA LTDA             ,De 100 a 249,43 - Rio Grande do S
92773142000100,2017,90.150.053,88006,Serviços de Assistên,92.773.142/0001-00,Outras Organizações,Outros,0,86,0,86,2196,2196,0,ASCAR                                              ,1000 ou Mais,43 - Rio Grande do S
21976459000103,2017,95.885.000,10333,Fabricação de Sucos,21.976.459/0001-03,Sociedade Qt Ltda,Microempresa,0,0,0,0,0,0,0,SUCOS IRMAOS RABAIOLI LTDA ME                     ,0 Empregado,43 - Rio Grande do S
73698367000102,2017,98.960.000,1628,Atividades de Apoio,73.698.367/0001-02,Cooperativa,Outros,0,0,0,0,26,26,0,COOPERATIVA DOS AGRICULTORES DE SANTO CRISTO LTDA  ,De 20 a 49,43 - Rio Grande do S
04983476000140,2017,96.010.140,46338,Comércio Atacadista,04.983.476/0001-40,Cooperativa,Outros,0,0,0,0,7,7,0,COOPSUL ECOLOGICA AGRICFAMILLTDA                ,De 5 a 9,43 - Rio Grande do S
09499014000176,2017,96.148.000,47296,Comércio Varejista d,09.499.014/0001-76,Cooperativa,Outros,0,0,0,0,3,3,0,COOP ATIV INDARTAGRICFAMTURUCU               ,De 1 a 4,43 - Rio Grande do S
15159381000123,2017,96.155.000,46338,Comércio Atacadista,15.159.381/0001-23,Cooperativa,Outros,0,0,0,0,0,0,0,COOP AGROPEC DE ARROIO DO PADRE COOPAP             ,0 Empregado,43 - Rio Grande do S
08394739000137,2017,97.200.000,94308,Atividades de Associ,08.394.739/0001-37,Cooperativa,Outros,0,0,0,0,0,0,0,COOPDA AGRICFAMILIAR DE RESTINGA SECA            ,0 Empregado,43 - Rio Grande do S
89305239000507,2017,95.940.000,10520,Fabricação de Laticí,89.305.239/0005-07,Cooperativa,Outros,8,2,0,2,173,173,0,COOP DOS SUINOCULTORES DE ENCANTADO LTDA           ,De 100 a 249,43 - Rio Grande do S
94890266000109,2017,96.170.000,1610,Atividades de Apoio,94.890.266/0001-09,Cooperativa,Outros,0,0,0,0,47,47,0,COOPERATIVA MISTA DOS PEQUENOS AGRICULTORES DA REGIA,De 20 a 49,43 - Rio Grande do S
07485034000162,2017,96.170.000,10996,Fabricação de Produt,07.485.034/0001-62,Firma Mercantil Indi,Microempresa,0,0,0,0,0,0,0,MIRIAN ROZANE BRITTO DA COSTA                      ,0 Empregado,43 - Rio Grande do S
14789447000104,2017,97.195.000,10333,Fabricação de Sucos,14.789.447/0001-04,Sociedade Qt Ltda,Microempresa,0,0,0,0,0,0,0,TORRI & TORRI LTDA ME                              ,0 Empregado,43 - Rio Grande do S
09341805000173,2017,97.250.000,94308,Atividades de Associ,09.341.805/0001-73,Outras Organizações,Outros,0,0,0,0,0,0,0,ASSOCIACAO REMANESCENTE QUILOMBO VOVO ISABEL       ,0 Empregado,43 - Rio Grande do S
11396328000195,2017,96.600.000,46231,Comércio Atacadista,11.396.328/0001-95,Cooperativa,Outros,0,0,0,0,8,8,0,COOPERATIVA UNIAO DOS AGRICULTORES FAMIL           ,De 5 a 9,43 - Rio Grande do S
11185973000169,2017,96.816.330,1610,Atividades de Apoio,11.185.973/0001-69,Cooperativa,Outros,0,0,0,0,2,2,0,COOPERATIVA REGIONAL DE ALIMENTOS SANTA            ,De 1 a 4,43 - Rio Grande do S
17821228000145,2017,96.880.000,46338,Comércio Atacadista,17.821.228/0001-45,Cooperativa,Outros,0,0,0,0,0,0,0,COOP MISTA AGRIC FAMILIARES DE VERA CRUZ COOPERVEC ,0 Empregado,43 - Rio Grande do S
89774160000100,2017,95.890.000,10121,"Abate de Suínos, Ave",89.774.160/0001-00,Cooperativa,Outros,3,3,0,3,89,89,0,COOPERATIVA LANGUIRU LTDA                          ,De 50 a 99,43 - Rio Grande do S
88587357002455,2017,95.335.000,47113,Comércio Varejista d,88.587.357/0024-55,Cooperativa,Outros,1,1,0,1,15,15,0,COOPERATIVA SANTA CLARA LTDA                       ,De 10 a 19,43 - Rio Grande do S
27520930000122,,,,,,,,,,,,,,,,,
10264853000194,2017,99.220.000,10333,Fabricação de Sucos,10.264.853/0001-94,Sociedade Qt Ltda,Microempresa,0,0,0,0,1,1,0,FABIO BAGGIO & CIA LTDA                            ,De 1 a 4,43 - Rio Grande do S
06101295000179,2017,95.185.000,10317,Fabricação de Conser,06.101.295/0001-79,Firma Mercantil Indi,Microempresa,0,0,0,0,0,0,0,F FOPPA AGROINDUSTRIA E SERVICOS  ME               ,0 Empregado,43 - Rio Grande do S
05047086000121,2017,99.709.436,47121,Comércio Varejista d,05.047.086/0001-21,Cooperativa,Outros,0,0,0,0,8,8,0,COOPERATIVA DE PRODUCAO E CONSUMO FAMILIAR NOSSA TER,De 5 a 9,43 - Rio Grande do S
14034692000101,2017,98.500.000,10333,Fabricação de Sucos,14.034.692/0001-01,Firma Mercantil Indi,Microempresa,0,0,0,0,0,0,0,LEILA TERESINHA SESTARI GUERRA                     ,0 Empregado,43 - Rio Grande do S
90049156000150,2017,95.720.000,11127,Fabricação de Vinho,90.049.156/0001-50,Cooperativa,Outros,9,4,0,4,180,180,0,COOPERATIVA VINICOLA GARIBALDI LTDA                ,De 100 a 249,43 - Rio Grande do S
21850845000146,2017,98.920.000,10317,Fabricação de Conser,21.850.845/0001-46,Sociedade Qt Ltda,Microempresa,0,0,0,0,0,0,0,AGROINDUSTRIA POLPAS DE FRUTAS CITRICAS DO ABREU LTD,0 Empregado,43 - Rio Grande do S
88587357000592,2017,95.185.000,10121,"Abate de Suínos, Ave",88.587.357/0005-92,Cooperativa,Outros,11,5,0,5,226,226,0,COOPERATIVA SANTA CLARA LTDA                       ,De 100 a 249,43 - Rio Grande do S
05728869000170,2017,95.975.000,10333,Fabricação de Sucos,05.728.869/0001-70,Sociedade Qt Ltda,Microempresa,0,0,0,0,0,0,0,INDUSTRIA DE SUCOS PUTINGUENSE LTDA                ,0 Empregado,43 - Rio Grande do S
10378011000163,2017,98.400.000,47296,Comércio Varejista d,10.378.011/0001-63,Cooperativa,Outros,0,0,0,0,1,1,0,COOP DOS PROD RURAIS  AGRIC FAMILIAR FW            ,De 1 a 4,43 - Rio Grande do S
09014609000194,2017,98.480.000,46338,Comércio Atacadista,09.014.609/0001-94,Cooperativa,Outros,0,0,0,0,0,0,0,COOPERATIVA MISTA DE PROD EXTREMO NORTE           ,0 Empregado,43 - Rio Grande do S
05904624000157,2017,98.780.765,47296,Comércio Varejista d,05.904.624/0001-57,Cooperativa,Outros,0,0,0,0,5,5,0,COOPERATIVA CENTRAL DA AGRICULTURA FAMILIAR LTDA   ,De 5 a 9,43 - Rio Grande do S
12448006000105,2017,95.360.000,10333,Fabricação de Sucos,12.448.006/0001-05,Firma Mercantil Indi,Microempresa,0,0,0,0,0,0,0,SILVONEI ZANON                                     ,0 Empregado,43 - Rio Grande do S
03034075000181,2017,99.950.000,47890,Comércio Varejista d,03.034.075/0001-81,Cooperativa,Outros,0,0,0,0,10,10,0,COOPERATIVA DE PRODUCAO AGROPECUARIA TERRA E VIDA LT,De 10 a 19,43 - Rio Grande do S
03834521000132,2017,98.380.000,10325,Fabricação de Conser,03.834.521/0001-32,Sociedade Qt Ltda,Microempresa,0,0,0,0,0,0,0,INDUSTRIA DE DOCES E CONSERVAS KINKAS LTDA         ,0 Empregado,43 - Rio Grande do S
09488055000167,2017,98.160.000,1610,Atividades de Apoio,09.488.055/0001-67,Cooperativa,Outros,0,0,0,0,0,0,0,COOPIVORA                                          ,0 Empregado,43 - Rio Grande do S
02701335000162,2017,95.185.000,10945,Fabricação de Massas,02.701.335/0001-62,Sociedade Qt Ltda,Microempresa,0,0,0,0,12,12,0,SALETE MARIA GASPERIN E CIA LTDA                   ,De 10 a 19,43 - Rio Grande do S
07635210000286,2017,95.240.000,46231,Comércio Atacadista,07.635.210/0002-86,Cooperativa,Outros,0,0,0,0,1,1,0,COOPERATIVA REG PRODUTORES ECOLOGISTAS LIT NORTE RS,De 1 a 4,43 - Rio Grande do S
20087710000108,2017,97.400.000,94308,Atividades de Associ,20.087.710/0001-08,Outras Organizações,Outros,0,0,0,0,0,0,0,ASSOC DE PEQ PROD DA AGROIND FAMILIAR PASSO DA CLARA,0 Empregado,43 - Rio Grande do S
22469865000134,2017,97.010.970,1610,Atividades de Apoio,22.469.865/0001-34,Cooperativa,Outros,0,0,0,0,0,0,0,CENTRAL DE COOP DA AGRICULTURA FAMILIAR UNICENTRAL ,0 Empregado,43 - Rio Grande do S
94480217000190,2017,99.010.102,94995,Atividades Associati,94.480.217/0001-90,Cooperativa,Outros,0,0,0,0,0,0,0,COOP MISTA E DE TRABALHO ALTERNATIVA LTD           ,0 Empregado,43 - Rio Grande do S
89982268000260,2017,98.400.000,47113,Comércio Varejista d,89.982.268/0002-60,Cooperativa,Outros,4,2,0,2,52,52,0,COOPERATIVA TRITICOLA FREDERICO WESTPHALEN LTDA    ,De 50 a 99,43 - Rio Grande do S
16741146000128,2017,98.920.000,47245,Comércio Varejista d,16.741.146/0001-28,Cooperativa,Outros,0,0,0,0,2,2,0,COOP PROD AGROINDUSTRIAL FAMILIAR CENTRAL COM DE HOR,De 1 a 4,43 - Rio Grande do S
09406013000130,2017,99.580.000,47211,Comércio Varejista d,09.406.013/0001-30,Sociedade Qt Ltda,Microempresa,0,0,0,0,4,4,0,ERNESTO ZAMBENEDETTI E CIA LTDA   ME               ,De 1 a 4,43 - Rio Grande do S
05371648000198,2017,99.585.000,10333,Fabricação de Sucos,05.371.648/0001-98,Firma Mercantil Indi,Microempresa,0,0,0,0,0,0,0,BALDUINO TOLOTTI                                   ,0 Empregado,43 - Rio Grande do S
06154922000130,,,,,,,,,,,,,,,,,
21146580000108,2017,92.010.300,86305,Atividades de Atençã,21.146.580/0001-08,Sociedade Qt Ltda,Pequeno Porte,0,0,0,0,0,0,0,MAXXI CONSULTAS MEDICAS LTDA EPP                   ,0 Empregado,43 - Rio Grande do S
07882029000193,2017,99.800.000,46311,Comércio Atacadista,07.882.029/0001-93,Cooperativa,Outros,0,0,0,0,1,1,0,COOPERATIVA AGRIC FAM MARCELINOS RAMOS COCEL LTDA  ,De 1 a 4,43 - Rio Grande do S
24672562000140,2017,98.460.000,87115,Atividades de Assist,24.672.562/0001-40,Firma Mercantil Indi,Microempresa,0,0,0,0,9,9,0,JOSE L DE ALMEIDA ME                               ,De 5 a 9,43 - Rio Grande do S
89305239005657,2017,95.960.000,47113,Comércio Varejista d,89.305.239/0056-57,Cooperativa,Outros,5,5,0,5,97,97,0,COOP DOS SUINOCULTORES DE ENCANTADO LTDA           ,De 50 a 99,43 - Rio Grande do S
12184219000177,2017,95.700.112,94995,Atividades Associati,12.184.219/0001-77,Outras Organizações,Outros,0,0,0,0,0,0,0,ASSOCIACAO DOS AGRICULTORES FAMILIARES DE BENTO    ,0 Empregado,43 - Rio Grande do S
01131231000105,2017,92.480.000,46320,Comércio Atacadista,01.131.231/0001-05,Cooperativa,Outros,0,0,0,0,0,0,0,COOP DE PROD AGROPEC SETE DE JULHO                 ,0 Empregado,43 - Rio Grande do S
16992534000181,2017,99.980.000,1636,Atividades de Pós-Co,16.992.534/0001-81,Cooperativa,Outros,0,0,0,0,1,1,0,COOP DE FRUTICULTORES FAMILIARES COOPAF            ,De 1 a 4,43 - Rio Grande do S
08602228000163,2017,98.125.000,94995,Atividades Associati,08.602.228/0001-63,Outras Organizações,Outros,0,0,0,0,1,1,0,ASSOC DOS FEIRANTES DE FORT DOS VALOS              ,De 1 a 4,43 - Rio Grande do S
06316591000197,2017,97.670.000,94308,Atividades de Associ,06.316.591/0001-97,Outras Organizações,Outros,0,0,0,0,4,4,0,ASSOCIACAO DOS COLABORADORES DE PROTECAO           ,De 1 a 4,43 - Rio Grande do S
02794010000171,2017,99.265.000,10333,Fabricação de Sucos,02.794.010/0001-71,Sociedade Qt Ltda,Microempresa,0,0,0,0,0,0,0,IRMAOS KOBELINSKI LTDA                             ,0 Empregado,43 - Rio Grande do S
12849375000100,2017,98.435.000,47121,Comércio Varejista d,12.849.375/0001-00,Cooperativa,Outros,0,0,0,0,0,0,0,COOPERATIVA DOS PEQUENOS PRODUTORES FAMILIARES DE PI,0 Empregado,43 - Rio Grande do S
90430414000143,2017,96.010.971,47245,Comércio Varejista d,90.430.414/0001-43,Cooperativa,Outros,0,0,0,0,4,4,0,COOPAPICFRUTIC ZONA SUL                         ,De 1 a 4,43 - Rio Grande do S
12877184000151,2017,96.060.000,46338,Comércio Atacadista,12.877.184/0001-51,Cooperativa,Outros,0,0,0,0,13,13,0,COOPERATIVA DOS PRODUTORES AGRICOLAS DO            ,De 10 a 19,43 - Rio Grande do S
88587357003001,2017,95.052.100,46311,Comércio Atacadista,88.587.357/0030-01,Cooperativa,Outros,2,0,0,0,30,30,0,COOPERATIVA SANTA CLARA LTDA                       ,De 20 a 49,43 - Rio Grande do S
08616387000117,2017,95.538.000,1610,Atividades de Apoio,08.616.387/0001-17,Cooperativa,Outros,0,0,0,0,5,5,0,COOPERATIVA MISTA DE AGRIC FAM DE ITATI            ,De 5 a 9,43 - Rio Grande do S
14506106000176,2017,95.300.000,46371,Comércio Atacadista,14.506.106/0001-76,Cooperativa,Outros,0,0,0,0,1,1,0,COOPERATIVA  LAGOENSE DE AGRICULTURA               ,De 1 a 4,43 - Rio Grande do S
17600767000154,2017,93.180.000,10911,Fabricação de Produt,17.600.767/0001-54,Sociedade Qt Ltda,Microempresa,0,0,0,0,0,0,0,AGROINDUSTRIA KIKORV LTDA ME                       ,0 Empregado,43 - Rio Grande do S
19834864000137,2017,94.750.000,46338,Comércio Atacadista,19.834.864/0001-37,Cooperativa,Outros,0,0,0,0,4,4,0,COOPERATIVA MISTA CAMPOS DE VIAMAO LTDA            ,De 1 a 4,43 - Rio Grande do S
29136425000104,,,,,,,,,,,,,,,,,
11069140000132,2017,95.380.000,10112,"Abate de Reses, Exce",11.069.140/0001-32,Cooperativa,Outros,0,0,0,0,0,0,0,COOPERATIVA MISTA AGROINDUSTRIAL DOS REASSENTADOS ES,0 Empregado,43 - Rio Grande do S
12309267000225,,,,,,,,,,,,,,,,,
91949420000174,2017,98.855.000,11127,Fabricação de Vinho,91.949.420/0001-74,Sociedade Qt Ltda,Microempresa,0,0,0,0,1,1,0,VINICOLA FIN LTDA                                  ,De 1 a 4,43 - Rio Grande do S
04642568000167,2017,95.720.000,11127,Fabricação de Vinho,04.642.568/0001-67,Cooperativa,Microempresa,0,0,0,0,3,3,0,COOPEG COOP DE PRODUTORES ECOLOGISTAS DE GARIBALDI L,De 1 a 4,43 - Rio Grande do S
29682996000144,,,,,,,,,,,,,,,,,
91589507000854,2017,93.990.000,47113,Comércio Varejista d,91.589.507/0008-54,Cooperativa,Outros,0,1,0,1,23,23,0,COOPERATIVA AGROPECUARIA PETROPOLIS LTDA           ,De 20 a 49,43 - Rio Grande do S
14169702000108,2017,95.074.307,46320,Comércio Atacadista,14.169.702/0001-08,Cooperativa,Pequeno Porte,0,0,0,0,11,11,0,COOPDE AGRICULT E AGROINDFAMDE CX LT           ,De 10 a 19,43 - Rio Grande do S
01526764000188,2017,95.250.000,10333,Fabricação de Sucos,01.526.764/0001-88,Cooperativa,Outros,0,0,0,0,2,2,0,COOPERATIVA AECIA DE AGRIC ECOLOGISTAS            ,De 1 a 4,43 - Rio Grande do S
07775105000161,2017,96.190.000,46231,Comércio Atacadista,07.775.105/0001-61,Cooperativa,Outros,0,0,0,0,0,0,0,COOPERATIVA AGROPECUARIA CENTRO SUL COOPACS LTDA   ,0 Empregado,43 - Rio Grande do S
02672101000134,2017,95.275.000,47113,Comércio Varejista d,02.672.101/0001-34,Cooperativa,Outros,0,0,0,0,8,8,0,COOPERATIVA AGRICOLA NOVA PADUA LTDA               ,De 5 a 9,43 - Rio Grande do S
18039013000130,2017,96.212.740,3116,Pesca em água Salgad,18.039.013/0001-30,Cooperativa,Outros,0,0,0,0,0,0,0,COOPESMI                                           ,0 Empregado,43 - Rio Grande do S
88587357001807,2017,95.360.000,47113,Comércio Varejista d,88.587.357/0018-07,Cooperativa,Outros,2,1,0,1,24,24,0,COOPERATIVA SANTA CLARA LTDA                       ,De 20 a 49,43 - Rio Grande do S
04582471000106,2017,95.330.000,11127,Fabricação de Vinho,04.582.471/0001-06,Sociedade Qt Ltda,Outros,0,0,0,0,0,0,0,VINICOLA SIMONETTO LTDA                           ,0 Empregado,43 - Rio Grande do S
09378991000115,2017,98.780.765,47296,Comércio Varejista d,09.378.991/0001-15,Cooperativa,Outros,0,0,0,0,2,2,0,COOP MISTA AGROPECUARIA E ECONOMIA SOLIDARIA COOPERS,De 1 a 4,43 - Rio Grande do S
16698837000196,2017,98.870.000,10121,"Abate de Suínos, Ave",16.698.837/0001-96,Sociedade Qt Ltda,Microempresa,0,0,0,0,5,5,0,AGROINDUSTRIA PROGRESSO LTDA ME                    ,De 5 a 9,43 - Rio Grande do S
91022632002740,2017,97.220.000,47113,Comércio Varejista d,91.022.632/0027-40,Cooperativa,Outros,0,2,0,2,35,35,0,COOP AGRIC MISTA NOVA PALMA LTDA                   ,De 20 a 49,43 - Rio Grande do S
22648335000153,,,,,,,,,,,,,,,,,
10684004000190,2017,95.400.000,46338,Comércio Atacadista,10.684.004/0001-90,Cooperativa,Outros,0,0,0,0,1,1,0,COOPAF -  SAO FCO DE PAULA                        ,De 1 a 4,43 - Rio Grande do S
06942198000109,2017,96.495.971,94308,Atividades de Associ,06.942.198/0001-09,Outras Organizações,Outros,0,0,0,0,9,9,0,INSTITUTO CULTURAL PADRE JOSIMO                    ,De 5 a 9,43 - Rio Grande do S
07508742000171,2017,99.700.036,47121,Comércio Varejista d,07.508.742/0001-71,Cooperativa,Outros,0,0,0,0,3,3,0,COOPERATIVA DE DESENVOLVIMENTO REGIONAL LTDA       ,De 1 a 4,43 - Rio Grande do S
11445065000167,2017,99.260.000,10520,Fabricação de Laticí,11.445.065/0001-67,Sociedade Qt Ltda,Microempresa,0,0,0,0,6,6,0,IND COM DE LATICINIOS MOCCELIN LTDA                ,De 5 a 9,43 - Rio Grande do S
91589507000188,2017,95.150.000,10520,Fabricação de Laticí,91.589.507/0001-88,Cooperativa,Outros,0,12,0,12,618,618,0,COOPERATIVA AGROPECUARIA PETROPOLIS LTDA           ,De 500 a 999,43 - Rio Grande do S
16979506000124,2017,95.730.000,10945,Fabricação de Massas,16.979.506/0001-24,Firma Mercantil Indi,Microempresa,0,0,0,0,2,2,0,ELIANE LUTZ SANDRIN-ME                             ,De 1 a 4,43 - Rio Grande do S
09238832000115,2017,98.865.000,10511,Preparação do Leite,09.238.832/0001-15,Cooperativa,Microempresa,0,0,0,0,0,0,0,COOPERATIVA DE AGRICULTORES FAMILIARES DE SAO MIGUEL,0 Empregado,43 - Rio Grande do S
28740933000134,2017,95.880.000,10139,Fabricação de Produt,28.740.933/0001-34,Sociedade Qt Ltda,Pequeno Porte,0,0,0,0,0,0,0,DIEHL INDUSTRIA DE PRODUTOS ALIMENTICIOS LTDA EPP  ,0 Empregado,43 - Rio Grande do S
